{
  "artifact": {
    "installedSizeBytes": 1980486,
    "sha256": "30ff900a0901e7692d0e71f6bd73c6fdfb1419f005b4cd6188d75b8a0348ee5c",
    "sizeBytes": 370305
  },
  "candidateId": "ink-node",
  "command": "pnpm --filter @eden/terminal-spike-harness measure -- --warmups 5 --trials 30 --fixture terminal-spike-r0-v1 --runtime-versions node=v24.15.0,bun=1.3.14 --terminal wsl2-agent-pty --host-load-policy \"WSL2 agent session; foreground work limited to measurement; ambient Windows and WSL services unchanged\" --output-dir spikes/terminal-framework/results --artifact-evidence <package-result.json> --artifact-evidence <package-result.json> --artifact-evidence <package-result.json>",
  "environment": {
    "arch": "x64",
    "cpuCount": 16,
    "cpuModel": "AMD Ryzen 7 9800X3D 8-Core Processor",
    "hostLoadPolicy": "WSL2 agent session; foreground work limited to measurement; ambient Windows and WSL services unchanged",
    "hostname": "DESKTOP-MB22V8A",
    "locale": "C.UTF-8",
    "osRelease": "6.6.87.2-microsoft-standard-WSL2",
    "platform": "linux",
    "runner": {
      "imageOs": null,
      "imageVersion": null,
      "name": null
    },
    "shell": "/usr/bin/zsh",
    "terminalId": "wsl2-agent-pty",
    "totalMemoryBytes": 49618780160,
    "versions": {
      "bun": "1.3.14",
      "node": "v24.15.0",
      "pnpm": "11.7.0"
    }
  },
  "fixtureId": "terminal-spike-r0-v1",
  "hardGateObservations": {
    "automatedPrimary": "passed",
    "realTerminalQa": "not-run",
    "stressNavigation": "not-run"
  },
  "matchingSurface": {
    "cases": {
      "cancellationCleanup": "not-run",
      "chineseIme": "not-run",
      "graphemeEditing": "not-run",
      "largeDiff": "not-run",
      "largeOutput": "not-run",
      "navigationEscapeAlt": "not-run",
      "pasteAndMultiline": "not-run",
      "rapidResize": "not-run"
    },
    "notes": [],
    "observedAt": null,
    "operator": null,
    "status": "not-run",
    "terminal": {
      "enhancedProtocols": null,
      "font": null,
      "height": null,
      "locale": "C.UTF-8",
      "name": "wsl2-agent-pty",
      "shell": "/usr/bin/zsh",
      "version": null,
      "width": null
    }
  },
  "recordedAt": "2026-07-14T14:25:03.834Z",
  "schemaVersion": "1",
  "source": {
    "commit": "1a961f41743eb888c7e9dcd3b8029c52cbef0156",
    "dirty": false,
    "artifactDirty": false
  },
  "summary": {
    "stableResidentSetBytes": {
      "failureCount": 0,
      "median": 189296640,
      "p95": 191238144,
      "successCount": 30
    },
    "startupMs": {
      "failureCount": 0,
      "median": 346.5,
      "p95": 379,
      "successCount": 30
    },
    "stateUpdateMs": {
      "failureCount": 0,
      "median": 40.39880850000009,
      "p95": 41.969001999998,
      "successCount": 30
    }
  },
  "trialCount": 30,
  "trials": [
    {
      "durationMs": 0,
      "endedAt": "2026-07-14T14:24:30.099Z",
      "exitCode": 0,
      "index": 1,
      "memory": {
        "method": "linux-procfs-rss",
        "residentSetBytes": 189530112,
        "status": "observed"
      },
      "outcome": "passed",
      "phase": "recorded",
      "shellSentinel": "observed",
      "startedAt": "2026-07-14T14:24:30.099Z",
      "startupMs": 0,
      "stateUpdateMs": 40.07904899999994,
      "terminalCleanup": "restored",
      "transcriptBytes": 1869,
      "transcriptSha256": "671ad6897cc9c913160394477c2afbfc1a6743660851c39098a05e44ec7fc2fe"
    },
    {
      "durationMs": 476,
      "endedAt": "2026-07-14T14:24:31.103Z",
      "exitCode": 0,
      "index": 2,
      "memory": {
        "method": "linux-procfs-rss",
        "residentSetBytes": 188776448,
        "status": "observed"
      },
      "outcome": "passed",
      "phase": "recorded",
      "shellSentinel": "observed",
      "startedAt": "2026-07-14T14:24:30.627Z",
      "startupMs": 343,
      "stateUpdateMs": 40.13097700000071,
      "terminalCleanup": "restored",
      "transcriptBytes": 1869,
      "transcriptSha256": "e33e25d2ba12ac9c868fbd8bc9544372a4d80a1ddae21e108f9762ef2aa3232e"
    },
    {
      "durationMs": 481,
      "endedAt": "2026-07-14T14:24:31.997Z",
      "exitCode": 0,
      "index": 3,
      "memory": {
        "method": "linux-procfs-rss",
        "residentSetBytes": 190357504,
        "status": "observed"
      },
      "outcome": "passed",
      "phase": "recorded",
      "shellSentinel": "observed",
      "startedAt": "2026-07-14T14:24:31.516Z",
      "startupMs": 344,
      "stateUpdateMs": 41.60038999999961,
      "terminalCleanup": "restored",
      "transcriptBytes": 1869,
      "transcriptSha256": "2c3268a1d7106aad82367e6ad9ede4bf131f4418d9ded1a26bc79ef505371b7c"
    },
    {
      "durationMs": 481,
      "endedAt": "2026-07-14T14:24:32.793Z",
      "exitCode": 0,
      "index": 4,
      "memory": {
        "method": "linux-procfs-rss",
        "residentSetBytes": 187772928,
        "status": "observed"
      },
      "outcome": "passed",
      "phase": "recorded",
      "shellSentinel": "observed",
      "startedAt": "2026-07-14T14:24:32.312Z",
      "startupMs": 349,
      "stateUpdateMs": 40.077573000000484,
      "terminalCleanup": "restored",
      "transcriptBytes": 1869,
      "transcriptSha256": "29db9f34f63a86e68504c2c273e70491d212e4f2a6471fd19d4b92dcf59c47a6"
    },
    {
      "durationMs": 475,
      "endedAt": "2026-07-14T14:24:34.732Z",
      "exitCode": 0,
      "index": 5,
      "memory": {
        "method": "linux-procfs-rss",
        "residentSetBytes": 191029248,
        "status": "observed"
      },
      "outcome": "passed",
      "phase": "recorded",
      "shellSentinel": "observed",
      "startedAt": "2026-07-14T14:24:34.257Z",
      "startupMs": 341,
      "stateUpdateMs": 39.28596000000107,
      "terminalCleanup": "restored",
      "transcriptBytes": 1869,
      "transcriptSha256": "1e7f0f1105b2ddf16fa5a35f6970cddd87f1e1b048cba2d91511a4329aad4473"
    },
    {
      "durationMs": 478,
      "endedAt": "2026-07-14T14:24:35.620Z",
      "exitCode": 0,
      "index": 6,
      "memory": {
        "method": "linux-procfs-rss",
        "residentSetBytes": 187404288,
        "status": "observed"
      },
      "outcome": "passed",
      "phase": "recorded",
      "shellSentinel": "observed",
      "startedAt": "2026-07-14T14:24:35.142Z",
      "startupMs": 343,
      "stateUpdateMs": 41.40081699999973,
      "terminalCleanup": "restored",
      "transcriptBytes": 1869,
      "transcriptSha256": "86f3caf05bd53a4192a216800daa095f74ed8823e482d19e12a6cfc728412e02"
    },
    {
      "durationMs": 479,
      "endedAt": "2026-07-14T14:24:36.426Z",
      "exitCode": 0,
      "index": 7,
      "memory": {
        "method": "linux-procfs-rss",
        "residentSetBytes": 188502016,
        "status": "observed"
      },
      "outcome": "passed",
      "phase": "recorded",
      "shellSentinel": "observed",
      "startedAt": "2026-07-14T14:24:35.947Z",
      "startupMs": 347,
      "stateUpdateMs": 40.489950999999564,
      "terminalCleanup": "restored",
      "transcriptBytes": 1869,
      "transcriptSha256": "0325bb0e22efd6d1b04b07379ac968b6293e52be97d7b58102304e5fa42f773f"
    },
    {
      "durationMs": 480,
      "endedAt": "2026-07-14T14:24:38.372Z",
      "exitCode": 0,
      "index": 8,
      "memory": {
        "method": "linux-procfs-rss",
        "residentSetBytes": 190275584,
        "status": "observed"
      },
      "outcome": "passed",
      "phase": "recorded",
      "shellSentinel": "observed",
      "startedAt": "2026-07-14T14:24:37.892Z",
      "startupMs": 346,
      "stateUpdateMs": 41.1291999999994,
      "terminalCleanup": "restored",
      "transcriptBytes": 1869,
      "transcriptSha256": "dc740a20babe0a0cb179e92a571de16d420c63c082205fc88b4cd2eb7208a6a0"
    },
    {
      "durationMs": 482,
      "endedAt": "2026-07-14T14:24:39.258Z",
      "exitCode": 0,
      "index": 9,
      "memory": {
        "method": "linux-procfs-rss",
        "residentSetBytes": 189063168,
        "status": "observed"
      },
      "outcome": "passed",
      "phase": "recorded",
      "shellSentinel": "observed",
      "startedAt": "2026-07-14T14:24:38.776Z",
      "startupMs": 350,
      "stateUpdateMs": 39.886649000000034,
      "terminalCleanup": "restored",
      "transcriptBytes": 1869,
      "transcriptSha256": "89eb9349cdacaeb4575dde4f12e149b91266a8285ec5a670bd4d8c28b880bc28"
    },
    {
      "durationMs": 478,
      "endedAt": "2026-07-14T14:24:40.065Z",
      "exitCode": 0,
      "index": 10,
      "memory": {
        "method": "linux-procfs-rss",
        "residentSetBytes": 189059072,
        "status": "observed"
      },
      "outcome": "passed",
      "phase": "recorded",
      "shellSentinel": "observed",
      "startedAt": "2026-07-14T14:24:39.587Z",
      "startupMs": 346,
      "stateUpdateMs": 40.33749199999875,
      "terminalCleanup": "restored",
      "transcriptBytes": 1869,
      "transcriptSha256": "85e1b958220fdbb6f3ceaa789c1ac1f6ba62e80a366ea00ffcd43a99010584e3"
    },
    {
      "durationMs": 498,
      "endedAt": "2026-07-14T14:24:42.028Z",
      "exitCode": 0,
      "index": 11,
      "memory": {
        "method": "linux-procfs-rss",
        "residentSetBytes": 188043264,
        "status": "observed"
      },
      "outcome": "passed",
      "phase": "recorded",
      "shellSentinel": "observed",
      "startedAt": "2026-07-14T14:24:41.530Z",
      "startupMs": 358,
      "stateUpdateMs": 41.28876300000047,
      "terminalCleanup": "restored",
      "transcriptBytes": 1869,
      "transcriptSha256": "2d7230093ceff8279fc5d6bf9f502f58ee69a9de06d390486f34eae1b1dfc0da"
    },
    {
      "durationMs": 490,
      "endedAt": "2026-07-14T14:24:42.926Z",
      "exitCode": 0,
      "index": 12,
      "memory": {
        "method": "linux-procfs-rss",
        "residentSetBytes": 187432960,
        "status": "observed"
      },
      "outcome": "passed",
      "phase": "recorded",
      "shellSentinel": "observed",